{
  "$schema": "../../schemas/hswm_legacy_root_paths.v1.schema.json",
  "count": 146,
  "paths": [
    {
      "kind": "markdown",
      "path": "ABSORB_CONTRACT_v1.md",
      "reason": "legacy research record: incoming links or historical SHA may bind this path"
    },
    {
      "kind": "markdown",
      "path": "AMENDMENT_OPEN_HSWM_KERNEL_V2_2026-07-22.md",
      "reason": "legacy research record: incoming links or historical SHA may bind this path"
    },
    {
      "kind": "markdown",
      "path": "CANON_DIRECTION_NEURAL_COGNITIVE_ENTITY_2026-07-23.md",
      "reason": "legacy research record: incoming links or historical SHA may bind this path"
    },
    {
      "kind": "markdown",
      "path": "DEFINITION_HSWM_CELLULAR_METANEURAL_SYSTEM_2026-07-26.md",
      "reason": "legacy research record: incoming links or historical SHA may bind this path"
    },
    {
      "kind": "markdown",
      "path": "DEFINITION_HSWM_PLASTIC_COGNITIVE_WIRING_2026-07-29.md",
      "reason": "legacy research record: incoming links or historical SHA may bind this path"
    },
    {
      "kind": "markdown",
      "path": "DESIGN_PHASE_B_FEDERATED_HSWM_2026-07-22.md",
      "reason": "legacy research record: incoming links or historical SHA may bind this path"
    },
    {
      "kind": "json",
      "path": "EVIDENCE_B1_IDENTITY_UNLOCK_2026-07-22.json",
      "reason": "legacy artifact: a writer, reader, manifest, or receipt may bind this path"
    },
    {
      "kind": "json",
      "path": "EVIDENCE_B2_ROUTING_SIGNAL_2026-07-23.json",
      "reason": "legacy artifact: a writer, reader, manifest, or receipt may bind this path"
    },
    {
      "kind": "json",
      "path": "EVIDENCE_C1_PRELUDE_BOOKSCALE_2026-07-23.json",
      "reason": "legacy artifact: a writer, reader, manifest, or receipt may bind this path"
    },
    {
      "kind": "json",
      "path": "EVIDENCE_E1_CONDITIONAL_TRAVERSAL_2026-07-23.json",
      "reason": "legacy artifact: a writer, reader, manifest, or receipt may bind this path"
    },
    {
      "kind": "json",
      "path": "EVIDENCE_P1_CLOSED_LEARNING_LOOP_2026-07-23.json",
      "reason": "legacy artifact: a writer, reader, manifest, or receipt may bind this path"
    },
    {
      "kind": "json",
      "path": "EVIDENCE_R1_T1_RETRY_2026-07-22.json",
      "reason": "legacy artifact: a writer, reader, manifest, or receipt may bind this path"
    },
    {
      "kind": "json",
      "path": "EVIDENCE_R2_ML_WALK_2026-07-22.json",
      "reason": "legacy artifact: a writer, reader, manifest, or receipt may bind this path"
    },
    {
      "kind": "json",
      "path": "EVIDENCE_R3_WALK_REGIME_2026-07-23.json",
      "reason": "legacy artifact: a writer, reader, manifest, or receipt may bind this path"
    },
    {
      "kind": "json",
      "path": "EVIDENCE_T1_ENTRANCE_REACH_2026-07-22.json",
      "reason": "legacy artifact: a writer, reader, manifest, or receipt may bind this path"
    },
    {
      "kind": "json",
      "path": "EVIDENCE_T3_SCORE_NULL_2026-07-23.json",
      "reason": "legacy artifact: a writer, reader, manifest, or receipt may bind this path"
    },
    {
      "kind": "markdown",
      "path": "EXISTENCE_SCOREBOARD.v1.md",
      "reason": "legacy research record: incoming links or historical SHA may bind this path"
    },
    {
      "kind": "markdown",
      "path": "H3_B3_COMPOSITION_PREREG_2026-07-20.md",
      "reason": "legacy research record: incoming links or historical SHA may bind this path"
    },
    {
      "kind": "json",
      "path": "H3_B3_RUN_MANIFEST_2026-07-20.json",
      "reason": "legacy artifact: a writer, reader, manifest, or receipt may bind this path"
    },
    {
      "kind": "json",
      "path": "H3_B3_RUN_MANIFEST_V4_2026-07-20.json",
      "reason": "legacy artifact: a writer, reader, manifest, or receipt may bind this path"
    },
    {
      "kind": "json",
      "path": "H3_B3_RUN_MANIFEST_V5_2026-07-20.json",
      "reason": "legacy artifact: a writer, reader, manifest, or receipt may bind this path"
    },
    {
      "kind": "markdown",
      "path": "H3_B3_V3_REFUSAL_2026-07-20.md",
      "reason": "legacy research record: incoming links or historical SHA may bind this path"
    },
    {
      "kind": "markdown",
      "path": "H3_B3_V4_PREOUTPUT_REFUSAL_2026-07-20.md",
      "reason": "legacy research record: incoming links or historical SHA may bind this path"
    },
    {
      "kind": "markdown",
      "path": "H3_B3_V4_RESTART_PREREG_2026-07-20.md",
      "reason": "legacy research record: incoming links or historical SHA may bind this path"
    },
    {
      "kind": "markdown",
      "path": "H3_B3_V5_RESTART_PREREG_2026-07-20.md",
      "reason": "legacy research record: incoming links or historical SHA may bind this path"
    },
    {
      "kind": "markdown",
      "path": "H3_C0_CHAIN_VIABILITY_DIAGNOSIS_2026-07-20.md",
      "reason": "legacy research record: incoming links or historical SHA may bind this path"
    },
    {
      "kind": "markdown",
      "path": "HSWM_CANONICAL_RESEARCH_DIRECTION_20260724.md",
      "reason": "legacy research record: incoming links or historical SHA may bind this path"
    },
    {
      "kind": "markdown",
      "path": "HSWM_CELLULAR_DURABLE_RUNTIME_V2_2026-07-26.md",
      "reason": "legacy research record: incoming links or historical SHA may bind this path"
    },
    {
      "kind": "markdown",
      "path": "HSWM_CELLULAR_LEAN_CONDITIONS_2026-07-26.md",
      "reason": "legacy research record: incoming links or historical SHA may bind this path"
    },
    {
      "kind": "markdown",
      "path": "HSWM_CELLULAR_RUNTIME_V1_2026-07-26.md",
      "reason": "legacy research record: incoming links or historical SHA may bind this path"
    },
    {
      "kind": "markdown",
      "path": "HSWM_CORE_DEV.md",
      "reason": "legacy research record: incoming links or historical SHA may bind this path"
    },
    {
      "kind": "markdown",
      "path": "HSWM_CORE_EXISTENCE_CONCENTRATION.md",
      "reason": "legacy research record: incoming links or historical SHA may bind this path"
    },
    {
      "kind": "json",
      "path": "LONGINUS_HSWM_CELLULAR_DEFINITION_BINDING_2026-07-26.json",
      "reason": "legacy artifact: a writer, reader, manifest, or receipt may bind this path"
    },
    {
      "kind": "json",
      "path": "LONGINUS_HSWM_CELLULAR_RUNTIME_BINDING_2026-07-26.json",
      "reason": "legacy artifact: a writer, reader, manifest, or receipt may bind this path"
    },
    {
      "kind": "json",
      "path": "LONGINUS_HSWM_DURABLE_RUNTIME_BINDING_2026-07-26.json",
      "reason": "legacy artifact: a writer, reader, manifest, or receipt may bind this path"
    },
    {
      "kind": "json",
      "path": "P1_GATE_DIAGNOSTIC_R2_2026-07-23.json",
      "reason": "legacy artifact: a writer, reader, manifest, or receipt may bind this path"
    },
    {
      "kind": "json",
      "path": "P1_PREPARE_MANIFEST_2026-07-23.json",
      "reason": "legacy artifact: a writer, reader, manifest, or receipt may bind this path"
    },
    {
      "kind": "json",
      "path": "P1_RANK_INVARIANCE_DIAGNOSTIC_R2_2026-07-23.json",
      "reason": "legacy artifact: a writer, reader, manifest, or receipt may bind this path"
    },
    {
      "kind": "json",
      "path": "P1_SPLIT_2026-07-23.json",
      "reason": "legacy artifact: a writer, reader, manifest, or receipt may bind this path"
    },
    {
      "kind": "json",
      "path": "PREREG_B1_IDENTITY_UNLOCK_2026-07-22.json",
      "reason": "legacy artifact: a writer, reader, manifest, or receipt may bind this path"
    },
    {
      "kind": "markdown",
      "path": "PREREG_F3V2_HARDER_TRANSFER_2026-07-26.md",
      "reason": "legacy research record: incoming links or historical SHA may bind this path"
    },
    {
      "kind": "json",
      "path": "PREREG_P1V3_POLICY_ACTUATION_2026-07-24.json",
      "reason": "legacy artifact: a writer, reader, manifest, or receipt may bind this path"
    },
    {
      "kind": "json",
      "path": "PREREG_P1V4_FRESH_POLICY_REPLICATION_2026-07-24.json",
      "reason": "legacy artifact: a writer, reader, manifest, or receipt may bind this path"
    },
    {
      "kind": "json",
      "path": "PREREG_P1_CLOSED_LEARNING_LOOP_2026-07-23.json",
      "reason": "legacy artifact: a writer, reader, manifest, or receipt may bind this path"
    },
    {
      "kind": "json",
      "path": "PREREG_R1_T1_RETRY_2026-07-22.json",
      "reason": "legacy artifact: a writer, reader, manifest, or receipt may bind this path"
    },
    {
      "kind": "json",
      "path": "PREREG_R2_ML_WALK_2026-07-22.json",
      "reason": "legacy artifact: a writer, reader, manifest, or receipt may bind this path"
    },
    {
      "kind": "json",
      "path": "PREREG_R3_WALK_REGIME_2026-07-23.json",
      "reason": "legacy artifact: a writer, reader, manifest, or receipt may bind this path"
    },
    {
      "kind": "json",
      "path": "PREREG_T1_ENTRANCE_REACH_2026-07-22.json",
      "reason": "legacy artifact: a writer, reader, manifest, or receipt may bind this path"
    },
    {
      "kind": "json",
      "path": "PREREG_T3_SCORE_NULL_2026-07-23.json",
      "reason": "legacy artifact: a writer, reader, manifest, or receipt may bind this path"
    },
    {
      "kind": "markdown",
      "path": "PROM_16_HSWM_SEMANTIC_WEIGHT_FIELD_MATHEMATICS_2026-07-26.md",
      "reason": "legacy research record: incoming links or historical SHA may bind this path"
    },
    {
      "kind": "markdown",
      "path": "PROM_16_UNPROVEN_CLAIMS_2026-07-25.md",
      "reason": "legacy research record: incoming links or historical SHA may bind this path"
    },
    {
      "kind": "markdown",
      "path": "PROM_16_WORLD_COMPILER_CERTIFIED_READOUT_ENVELOPE_2026-07-20.md",
      "reason": "legacy research record: incoming links or historical SHA may bind this path"
    },
    {
      "kind": "markdown",